,Unnamed: 0.1,Unnamed: 0,Good_Reads_Popularity_Rank,Title,Author,Avg_Rating,Num_Ratings,ISBN,ASIN,Genres,Series,Page_Number,Format,Rank_Score,Rating_Score,NumRatings_Score,Quality_Score,Genre_List,Cluster,PCA1,PCA2,Age_Group_Min
316,332,332,428.0,The Tell-Tale Heart and Other Writings,Edgar Allan Poe,4.19,242797.0,9780553212280,0553212281,"Classics, Horror, Fiction, Short Stories, Poetry, Gothic, Mystery",,448,Mass Market Paperback,0.1643835616438356,0.7975000000000001,0.0259468525572566,0.4463326035502731,"['Classics', 'Horror', 'Fiction', 'Short Stories', 'Poetry', 'Gothic', 'Mystery']",4,-0.2491798047735707,0.27589907869930536,18
317,290,290,380.0,Fifty Shades Darker,E.L. James,3.83,951056.0,9781612130583,1612130585,"Romance, Fiction, Erotica, BDSM, Contemporary, Contemporary Romance, Chick Lit","Fifty Shades, #2",532,Paperback,0.2583170254403131,0.7075,0.1019587477176598,0.4438189432894932,"['Romance', 'Fiction', 'Erotica', 'BDSM', 'Contemporary', 'Contemporary Romance', 'Chick Lit']",4,-0.26268887156083626,0.23008623211702947,18
318,259,259,343.0,The Woman in Cabin 10,Ruth Ware,3.73,686207.0,9781501132933,1501132938,"Mystery, Thriller, Fiction, Mystery Thriller, Suspense, Audiobook, Crime","Lo Blacklock, #1",341,Hardcover,0.3307240704500978,0.6825,0.073534577433431,0.4423146619708822,"['Mystery', 'Thriller', 'Fiction', 'Mystery Thriller', 'Suspense', 'Audiobook', 'Crime']",4,-0.295560812396539,0.42378190862695664,18
319,339,339,437.0,Dark Lover,J.R. Ward,4.16,345527.0,9780451216953,0451216954,"Paranormal, Vampires, Paranormal Romance, Fantasy, Urban Fantasy, Fiction, Supernatural","Black Dagger Brotherhood, #1",393,Mass Market Paperback,0.1467710371819961,0.79,0.0369720594234288,0.4409357741513562,"['Paranormal', 'Vampires', 'Paranormal Romance', 'Fantasy', 'Urban Fantasy', 'Fiction', 'Supernatural']",4,-0.3079084284036629,0.15937044177433812,18
320,314,314,407.0,If I Stay,Gayle Forman,3.91,946043.0,9780525421030,0525421033,"Young Adult, Romance, Contemporary, Fiction, Realistic Fiction, Teen, Music","If I Stay, #1",208,Hardcover,0.2054794520547944,0.7275,0.1014207416627574,0.440475048429388,"['Young Adult', 'Romance', 'Contemporary', 'Fiction', 'Realistic Fiction', 'Teen', 'Music']",0,-0.19805277408755348,-0.27791896837144386,8
321,252,252,333.0,Candide,Voltaire,3.76,289578.0,9780486266893,0486266893,"Fiction, Philosophy, France, Classics, Literature, French Literature, Humor",,129,Paperback,0.350293542074364,0.69,0.0309674911477988,0.4403152583055407,"['Fiction', 'Philosophy', 'France', 'Classics', 'Literature', 'French Literature', 'Humor']",4,-0.22713616111241688,0.2447688329573365,18
322,338,338,436.0,The Martian Chronicles,Ray Bradbury,4.16,275316.0,9780553278224,B00LNVWRG0,"Science Fiction, Fiction, Classics, Short Stories, Fantasy, Science Fiction Fantasy, Audiobook",,182,Mass Market Paperback,0.1487279843444227,0.79,0.0294368623117689,0.4395412116640479,"['Science Fiction', 'Fiction', 'Classics', 'Short Stories', 'Fantasy', 'Science Fiction Fantasy', 'Audiobook']",4,-0.040557942928059386,0.2291562029296255,18
323,376,376,486.0,A Fine Balance,Rohinton Mistry,4.38,154810.0,9781400030651,140003065X,"Fiction, Historical Fiction, India, Indian Literature, Literary Fiction, Historical, Asia",,603,Paperback,0.050880626223092,0.845,0.0165038964924859,0.4393461306788945,"['Fiction', 'Historical Fiction', 'India', 'Indian Literature', 'Literary Fiction', 'Historical', 'Asia']",1,0.05533438007616371,0.2572467232527599,18
324,345,345,446.0,Hidden Pictures,Jason Rekulak,4.16,447917.0,9781250819345,1250819342,"Horror, Thriller, Mystery, Fiction, Mystery Thriller, Audiobook, Paranormal",,372,Hardcover,0.1291585127201566,0.79,0.0479607767506688,0.4392798223677064,"['Horror', 'Thriller', 'Mystery', 'Fiction', 'Mystery Thriller', 'Audiobook', 'Paranormal']",4,-0.301404790875875,0.3890826857702738,18
325,297,297,389.0,Bridget Jones’s Diary,Helen Fielding,3.81,1005492.0,9780140280098,014028009X,"Fiction, Chick Lit, Romance, Contemporary, Humor, Comedy, Adult Fiction","Bridget Jones, #1",288,Hardcover,0.2407045009784736,0.7025,0.1078009375450417,0.4383763596308788,"['Fiction', 'Chick Lit', 'Romance', 'Contemporary', 'Humor', 'Comedy', 'Adult Fiction']",4,-0.08474865029882525,0.16840969664500638,18
326,344,344,445.0,Red Queen,Victoria Aveyard,3.99,1105466.0,9780062310637,0062310631,"Young Adult, Dystopia, Romance, Fiction, Young Adult Fantasy, Audiobook, Magic","Red Queen, #1",388,Hardcover,0.1311154598825832,0.7475,0.1185303645015169,0.4361614560960251,"['Young Adult', 'Dystopia', 'Romance', 'Fiction', 'Young Adult Fantasy', 'Audiobook', 'Magic']",0,-0.430386279730562,-0.33975934769199606,8
327,358,358,463.0,Coraline,Neil Gaiman,4.13,746739.0,9780061139376,0061139378,"Fantasy, Horror, Fiction, Young Adult, Middle Grade, Childrens, Audiobook",,176,Paperback,0.095890410958904,0.7825,0.0800310032294315,0.4352303535470839,"['Fantasy', 'Horror', 'Fiction', 'Young Adult', 'Middle Grade', 'Childrens', 'Audiobook']",0,-0.3874136666822819,-0.34109943613414356,8
328,340,340,438.0,Brisingr,Christopher Paolini,4.1,398804.0,9780375826726,0375826726,"Fantasy, Young Adult, Fiction, Dragons, Adventure, Magic, High Fantasy",The Inheritance Cycle #3,748,Hardcover,0.1448140900195695,0.7749999999999999,0.0426898628519214,0.4343759882178727,"['Fantasy', 'Young Adult', 'Fiction', 'Dragons', 'Adventure', 'Magic', 'High Fantasy']",0,-0.38943497771600016,-0.300851355154927,8
329,313,313,406.0,The Gunslinger,Stephen King,3.92,640743.0,9781501143519,1501143514,"Fantasy, Fiction, Horror, Science Fiction, Audiobook, Adventure, Science Fiction Fantasy","The Dark Tower, #1",231,Paperback,0.2074363992172212,0.73,0.0686552821451641,0.4340229203405963,"['Fantasy', 'Fiction', 'Horror', 'Science Fiction', 'Audiobook', 'Adventure', 'Science Fiction Fantasy']",4,0.0009558460955228808,0.2221037333358662,18
330,348,348,450.0,The Amazing Adventures of Kavalier & Clay,Michael Chabon,4.18,207938.0,9780312282998,B007C4D1G2,"Fiction, Historical Fiction, Novels, Literary Fiction, Literature, Historical, Contemporary",,639,Paperback,0.1213307240704502,0.7949999999999999,0.0222057089171525,0.4333841082469006,"['Fiction', 'Historical Fiction', 'Novels', 'Literary Fiction', 'Literature', 'Historical', 'Contemporary']",1,0.19344982743890882,0.28197908026059076,18
331,377,377,487.0,Hopeless,Colleen Hoover,4.23,640894.0,9781301949823,B08GWTKXCP,"Romance, New Adult, Young Adult, Contemporary, Fiction, Contemporary Romance, Abuse","Hopeless, #1",410,Kindle Edition,0.0489236790606653,0.8075000000000001,0.068671487793337,0.4331487917135006,"['Romance', 'New Adult', 'Young Adult', 'Contemporary', 'Fiction', 'Contemporary Romance', 'Abuse']",0,-0.40143876882025775,-0.25060417681200325,8
332,275,275,360.0,Final Girls,Riley Sager,3.82,228707.0,9781101985366,1101985364,"Thriller, Horror, Mystery, Mystery Thriller, Fiction, Audiobook, Suspense",,352,Hardcover,0.2974559686888454,0.705,0.0244346831350395,0.4329726629559712,"['Thriller', 'Horror', 'Mystery', 'Mystery Thriller', 'Fiction', 'Audiobook', 'Suspense']",4,-0.2933327780241515,0.417385452397895,18
333,361,361,466.0,The Last Song,Nicholas Sparks,4.16,565019.0,9780446547567,B0046NN9AU,"Romance, Fiction, Young Adult, Contemporary, Chick Lit, Drama, Contemporary Romance",,390,Paperback,0.0900195694716243,0.79,0.060528417891937,0.4326369968408904,"['Romance', 'Fiction', 'Young Adult', 'Contemporary', 'Chick Lit', 'Drama', 'Contemporary Romance']",0,-0.3905166170984877,-0.2173608476790857,8
334,305,305,397.0,Franny and Zooey,J.D. Salinger,3.96,231732.0,9780316769020,0316769029,"Fiction, Short Stories, Literature, Classics, American, Novels, Literary Fiction",,201,Paperback,0.2250489236790607,0.74,0.0247593327093622,0.4324520640971057,"['Fiction', 'Short Stories', 'Literature', 'Classics', 'American', 'Novels', 'Literary Fiction']",4,-0.06317455308263835,0.250853099875521,18
335,391,391,502.0,I Know Why the Caged Bird Sings,Maya Angelou,4.3,557511.0,9780553279375,B00P4JQBIC,"Nonfiction, Classics, Memoir, Biography, Autobiography, Poetry, Feminism","Maya Angelou's Autobiography, #1",289,Paperback,0.0195694716242662,0.825,0.0597226430145768,0.4323230286597107,"['Nonfiction', 'Classics', 'Memoir', 'Biography', 'Autobiography', 'Poetry', 'Feminism']",4,-0.36714732131191286,0.22209999630606728,18
336,346,346,447.0,Miss Peregrine's Home for Peculiar Children,Ransom Riggs,3.92,1320116.0,9781594744761,1594744769,"Fantasy, Young Adult, Fiction, Paranormal, Mystery, Horror, Historical Fiction","Miss Peregrine's Peculiar Children, #1",352,Hardcover,0.1272015655577298,0.73,0.1415670690067622,0.432192158641123,"['Fantasy', 'Young Adult', 'Fiction', 'Paranormal', 'Mystery', 'Horror', 'Historical Fiction']",0,-0.17275436928351645,-0.22116464608779027,8
337,341,341,440.0,Steppenwolf,Hermann Hesse,4.13,201227.0,9780140282580,0140282580,"Fiction, Classics, Philosophy, German Literature, Literature, Novels, Germany",,256,Paperback,0.1409001956947162,0.7825,0.0214854698119361,0.4318464163766631,"['Fiction', 'Classics', 'Philosophy', 'German Literature', 'Literature', 'Novels', 'Germany']",4,-0.22947292576692413,0.2519195203132038,18
338,336,336,433.0,Eldest,Christopher Paolini,4.04,473102.0,9780375840401,0375840400,"Fantasy, Young Adult, Fiction, Dragons, Adventure, Magic, High Fantasy","The Inheritance Cycle, #2",704,Paperback,0.1545988258317026,0.76,0.0506636856859802,0.4313156278794207,"['Fantasy', 'Young Adult', 'Fiction', 'Dragons', 'Adventure', 'Magic', 'High Fantasy']",0,-0.38944746127412655,-0.30081250001494575,8
339,369,369,476.0,The One,Kiera Cass,4.14,741238.0,9780062059994,0062059998,"Romance, Young Adult, Dystopia, Fantasy, Fiction, Audiobook, Science Fiction","The Selection, #3",323,Hardcover,0.0704500978473581,0.7849999999999999,0.0794406239539441,0.4299726804503255,"['Romance', 'Young Adult', 'Dystopia', 'Fantasy', 'Fiction', 'Audiobook', 'Science Fiction']",0,-0.20358361991406915,-0.2701948250898995,8
340,281,281,368.0,Mrs. Dalloway,Virginia Woolf,3.79,329731.0,9780151009985,0151009988,"Fiction, Classics, Literature, Novels, Feminism, Literary Fiction, British Literature",,194,Hardcover,0.2818003913894324,0.6975,0.035276798373511,0.4280192974407358,"['Fiction', 'Classics', 'Literature', 'Novels', 'Feminism', 'Literary Fiction', 'British Literature']",4,-0.08070344196986248,0.2464330234793023,18
341,363,363,468.0,All the Bright Places,Jennifer Niven,4.12,604253.0,9780385755887,0385755880,"Young Adult, Romance, Contemporary, Fiction, Mental Health, Realistic Fiction, Mental Illness",,388,Hardcover,0.086105675146771,0.78,0.0647390960403591,0.4277111927967825,"['Young Adult', 'Romance', 'Contemporary', 'Fiction', 'Mental Health', 'Realistic Fiction', 'Mental Illness']",0,-0.254932990039922,-0.2463759584261654,8
342,328,328,423.0,Inferno,Dante Alighieri,4.03,195592.0,9780812970067,B0BQJ59T18,"Classics, Poetry, Fiction, Literature, Religion, Fantasy, School",,490,Kindle Edition,0.1741682974559686,0.7575000000000001,0.0208807093652226,0.4275122517052978,"['Classics', 'Poetry', 'Fiction', 'Literature', 'Religion', 'Fantasy', 'School']",0,-0.3141234169867738,-0.22112167426326132,8
343,381,381,492.0,A Feast for Crows,George R.R. Martin,4.17,766454.0,9780553582024,B005JV4KFG,"Fantasy, Fiction, Epic Fantasy, High Fantasy, Science Fiction Fantasy, Audiobook, Dragons","A Song of Ice and Fire, #4",1060,Mass Market Paperback,0.0391389432485322,0.7925,0.0821468598766288,0.4265714507812903,"['Fantasy', 'Fiction', 'Epic Fantasy', 'High Fantasy', 'Science Fiction Fantasy', 'Audiobook', 'Dragons']",0,-0.21023691452132945,0.18974324429114903,18
344,350,350,453.0,The Amber Spyglass,Philip Pullman,4.1,372702.0,9780440238157,0440238153,"Fantasy, Young Adult, Fiction, Adventure, Audiobook, Science Fiction, Childrens","His Dark Materials, #3",465,Mass Market Paperback,0.1154598825831703,0.7749999999999999,0.0398885394836665,0.4263371055167091,"['Fantasy', 'Young Adult', 'Fiction', 'Adventure', 'Audiobook', 'Science Fiction', 'Childrens']",0,-0.1946146360614787,-0.3165372347461008,8
345,355,355,459.0,The Firm,Robin Waterfield,4.06,633429.0,9780582418271,0582418275,"Fiction, Thriller, Mystery, Crime, Suspense, Mystery Thriller, Legal Thriller",,76,Paperback,0.1037181996086105,0.7649999999999999,0.0678703277694299,0.42539713184451,"['Fiction', 'Thriller', 'Mystery', 'Crime', 'Suspense', 'Mystery Thriller', 'Legal Thriller']",4,-0.3074512838331907,0.3997737959849528,18
346,322,322,415.0,Fifty Shades Freed,E.L. James,3.83,892739.0,9780345803504,B00DNW19FC,"Romance, Erotica, Fiction, BDSM, Contemporary, Contemporary Romance, Chick Lit","Fifty Shades, #3",579,Paperback,0.1898238747553815,0.7075,0.0957000405355848,0.4251309788227416,"['Romance', 'Erotica', 'Fiction', 'BDSM', 'Contemporary', 'Contemporary Romance', 'Chick Lit']",4,-0.26276510189481156,0.23032349943035627,18
347,371,371,478.0,Local Woman Missing,Mary Kubica,4.13,629481.0,9780778311669,077831166X,"Thriller, Mystery, Mystery Thriller, Audiobook, Fiction, Suspense, Crime",,356,Paperback,0.066536203522505,0.7825,0.0674466198291237,0.4247457058379071,"['Thriller', 'Mystery', 'Mystery Thriller', 'Audiobook', 'Fiction', 'Suspense', 'Crime']",4,-0.2956324781681641,0.4240049687160875,18
348,379,379,489.0,"Red, White & Royal Blue",Casey McQuiston,4.06,1140209.0,9781250316776,1250316774,"Romance, LGBT, Contemporary, Fiction, Queer, Young Adult, Enemies To Lovers",,448,Paperback,0.0450097847358121,0.7649999999999999,0.1222590587695147,0.4243172108763317,"['Romance', 'LGBT', 'Contemporary', 'Fiction', 'Queer', 'Young Adult', 'Enemies To Lovers']",0,-0.3524401306888344,-0.23676354408658987,8
349,333,333,430.0,Cloud Atlas,David Mitchell,4.01,258864.0,9780375507250,B00A2M3QD4,"Fiction, Science Fiction, Fantasy, Historical Fiction, Dystopia, Literary Fiction, Contemporary",,509,Paperback,0.1604696673189825,0.7525,0.0276711979161468,0.4232852163087823,"['Fiction', 'Science Fiction', 'Fantasy', 'Historical Fiction', 'Dystopia', 'Literary Fiction', 'Contemporary']",1,0.30369717522702827,0.21631234837150562,18
350,335,335,432.0,The Hunchback of Notre-Dame,Victor Hugo,4.02,210004.0,9780451527882,0451527887,"Fiction, Classics, Historical Fiction, France, Literature, Gothic, French Literature",,510,Paperback,0.1565557729941291,0.7549999999999999,0.0224274365272519,0.4222458023803452,"['Fiction', 'Classics', 'Historical Fiction', 'France', 'Literature', 'Gothic', 'French Literature']",1,-0.06057043327168392,0.24239372917260565,18
351,357,357,462.0,Dear John,Nicholas Sparks,4.04,610444.0,9780446528054,0446528056,"Romance, Fiction, Chick Lit, Contemporary, Contemporary Romance, Young Adult, Adult Fiction",,276,Hardcover,0.0978473581213308,0.76,0.065403527615444,0.4208127214341937,"['Romance', 'Fiction', 'Chick Lit', 'Contemporary', 'Contemporary Romance', 'Young Adult', 'Adult Fiction']",0,-0.2697250250194125,-0.2661464165489458,8
352,320,320,413.0,Tuck Everlasting,Natalie Babbitt,3.9,285711.0,9780374480097,0374480095,"Fantasy, Classics, Young Adult, Fiction, Childrens, Middle Grade, School",,148,Paperback,0.1937377690802348,0.725,0.0305524763035324,0.4185725613459418,"['Fantasy', 'Classics', 'Young Adult', 'Fiction', 'Childrens', 'Middle Grade', 'School']",0,-0.39165495527871913,-0.39669046805374586,8
353,303,303,395.0,American Psycho,Bret Easton Ellis,3.81,340536.0,9780679735779,0679735771,"Fiction, Horror, Classics, Thriller, Crime, Contemporary, Novels",,399,Paperback,0.2289628180039138,0.7025,0.0364364144563396,0.4175998081150633,"['Fiction', 'Horror', 'Classics', 'Thriller', 'Crime', 'Contemporary', 'Novels']",4,-0.20547208113854357,0.31223310079613165,18
354,394,394,505.0,Persuasion,Jane Austen,4.15,738884.0,9780192802637,0192802631,"Fiction, Classics, Historical Fiction, Audiobook, Historical, Literature, 19th Century",,249,Paperback,0.0136986301369863,0.7875000000000001,0.0791879875579258,0.4169716544237281,"['Fiction', 'Classics', 'Historical Fiction', 'Audiobook', 'Historical', 'Literature', '19th Century']",1,-0.04116298413056197,0.26449247887990257,18
355,331,331,427.0,Cold Mountain,Charles Frazier,3.89,246749.0,9780802142849,0802142842,"Historical Fiction, Fiction, Historical, Romance, Civil War, War, Classics",,449,Paperback,0.1663405088062621,0.7225,0.026370989786256,0.4094278746481296,"['Historical Fiction', 'Fiction', 'Historical', 'Romance', 'Civil War', 'War', 'Classics']",1,-0.09645546837739494,0.2533657886011555,18
356,285,285,373.0,The Awakening,Kate Chopin,3.68,218930.0,9780543898081,0543898083,"Classics, Fiction, Feminism, School, Literature, Historical Fiction, Read For School",,195,Paperback,0.2720156555772994,0.67,0.0233853942463938,0.4088502624559234,"['Classics', 'Fiction', 'Feminism', 'School', 'Literature', 'Historical Fiction', 'Read For School']",1,-0.16312873950397608,-0.2076536903963191,8
357,396,396,509.0,Sharp Objects,Gillian Flynn,4.01,1148397.0,9780297851530,0297851535,"Mystery, Thriller, Fiction, Mystery Thriller, Crime, Audiobook, Suspense",,254,Paperback,0.0058708414872798,0.7525,0.1231378127247393,0.4085021635530048,"['Mystery', 'Thriller', 'Fiction', 'Mystery Thriller', 'Crime', 'Audiobook', 'Suspense']",4,-0.29569873742585506,0.4242112010023113,18
358,337,337,435.0,Dr. Jekyll and Mr. Hyde,Robert Louis Stevenson,3.83,628127.0,9780451528957,0451528956,"Horror, Gothic, Mystery, Science Fiction, Fantasy, Audiobook, Literature",,139,Mass Market Paperback,0.1506849315068492,0.7075,0.0673013056064352,0.4082465592783211,"['Horror', 'Gothic', 'Mystery', 'Science Fiction', 'Fantasy', 'Audiobook', 'Literature']",4,-0.2821094974379171,0.33578384066345,18
359,310,310,403.0,Allegiant,Veronica Roth,3.6,1105978.0,9780007524273,0007524277,"Young Adult, Dystopia, Fiction, Fantasy, Science Fiction, Romance, Adventure","Divergent, #3",531,Hardcover,0.2133072407045009,0.65,0.1185853134542618,0.4079731385396907,"['Young Adult', 'Dystopia', 'Fiction', 'Fantasy', 'Science Fiction', 'Romance', 'Adventure']",0,-0.2094783344953938,-0.2940422304306065,8
360,385,385,496.0,Pippi Longstocking,Astrid Lindgren,4.15,205101.0,9780142402498,0142402494,"Classics, Childrens, Fiction, Middle Grade, Fantasy, Young Adult, Humor","Pippi Långstrump, #1",160,Mass Market Paperback,0.0313111545988258,0.7875000000000001,0.0219012359114158,0.4070530976275605,"['Classics', 'Childrens', 'Fiction', 'Middle Grade', 'Fantasy', 'Young Adult', 'Humor']",0,-0.3870413396261168,-0.37204924165330916,8
361,372,372,479.0,Breakfast of Champions,Kurt Vonnegut Jr.,4.06,271423.0,9780385334204,0385334206,"Fiction, Classics, Science Fiction, Humor, Literature, Novels, American",,303,Paperback,0.0645792563600782,0.7649999999999999,0.029019057090996,0.4058995783627685,"['Fiction', 'Classics', 'Science Fiction', 'Humor', 'Literature', 'Novels', 'American']",4,-0.027239016827770586,0.24839146744239737,18
362,356,356,461.0,Doctor Zhivago,Boris Pasternak,4.01,99986.0,9780679774389,0679774386,"Fiction, Historical Fiction, Russia, Russian Literature, Classics, Romance, Literature",,592,Paperback,0.0998043052837573,0.7525,0.010620065661852,0.4038560927364023,"['Fiction', 'Historical Fiction', 'Russia', 'Russian Literature', 'Classics', 'Romance', 'Literature']",1,-0.06793448020898946,0.2438900152914155,18
363,383,383,494.0,Carrie,Stephen King,3.99,793640.0,9781416524304,1416524304,"Horror, Fiction, Thriller, Classics, Fantasy, Paranormal, Supernatural",,272,Mass Market Paperback,0.0352250489236791,0.7475,0.0850645204807732,0.4038223923511131,"['Horror', 'Fiction', 'Thriller', 'Classics', 'Fantasy', 'Paranormal', 'Supernatural']",4,-0.24508947810141563,0.2330239705216885,18
364,364,364,470.0,Crescendo,Becca Fitzpatrick,3.98,332266.0,9781416989431,1416989439,"Young Adult, Fantasy, Romance, Angels, Paranormal, Paranormal Romance, Fiction","Hush, Hush, #2",427,Hardcover,0.0821917808219179,0.745,0.035548860082902,0.401935160226205,"['Young Adult', 'Fantasy', 'Romance', 'Angels', 'Paranormal', 'Paranormal Romance', 'Fiction']",0,-0.4234658354731389,-0.27215917389145067,8
365,367,367,474.0,A Streetcar Named Desire,Tennessee Williams,3.98,327489.0,9780822210894,0822210894,"Plays, Classics, Fiction, Drama, School, Read For School, Literature",,107,Paperback,0.0743639921722114,0.745,0.0350361820609055,0.3998500435582792,"['Plays', 'Classics', 'Fiction', 'Drama', 'School', 'Read For School', 'Literature']",0,-0.32381515575191683,-0.21274858499535684,8
366,360,360,465.0,Midnight’s Children,Salman Rushdie,3.98,129100.0,9780099578512,0099578514,"Fiction, Magical Realism, Classics, India, Historical Fiction, Fantasy, Literature",,647,Paperback,0.0919765166340509,0.745,0.0137446434161763,0.3989302900125568,"['Fiction', 'Magical Realism', 'Classics', 'India', 'Historical Fiction', 'Fantasy', 'Literature']",1,-0.0618983459935935,0.21759501620062266,18
367,342,342,441.0,Beautiful Creatures,Kami Garcia,3.77,613053.0,9780316042673,0316042676,"Fantasy, Young Adult, Romance, Paranormal, Fiction, Magic, Supernatural","Caster Chronicles, #1",563,Hardcover,0.1389432485322896,0.6925,0.0656835311656615,0.3974066949244878,"['Fantasy', 'Young Adult', 'Romance', 'Paranormal', 'Fiction', 'Magic', 'Supernatural']",0,-0.3850514480290647,-0.29864490590189613,8
368,375,375,485.0,Daughter of Smoke & Bone,Laini Taylor,3.99,379088.0,9780316134026,0316134023,"Fantasy, Young Adult, Romance, Paranormal, Urban Fantasy, Angels, Fiction","Daughter of Smoke & Bone, #1",418,Hardcover,0.0528375733855186,0.7475,0.0405738988825508,0.3971028680670174,"['Fantasy', 'Young Adult', 'Romance', 'Paranormal', 'Urban Fantasy', 'Angels', 'Fiction']",0,-0.4162355791781537,-0.2982033261448677,8
369,395,395,507.0,The Raven Boys,Maggie Stiefvater,4.05,388254.0,9780545424929,0545424925,"Fantasy, Young Adult, Paranormal, Romance, Fiction, Audiobook, Urban Fantasy","The Raven Cycle, #1",409,Hardcover,0.009784735812133,0.7625,0.0415576139232919,0.3940855874338562,"['Fantasy', 'Young Adult', 'Paranormal', 'Romance', 'Fiction', 'Audiobook', 'Urban Fantasy']",0,-0.42779219550631375,-0.29963042666950296,8
370,389,389,500.0,The Scarlet Pimpernel,Emmuska Orczy,4.07,138835.0,9781576469231,1576469239,"Classics, Historical Fiction, Fiction, Adventure, Historical, Mystery, France",,182,Paperback,0.0234833659491193,0.7675000000000001,0.0147894247735421,0.3933181976806654,"['Classics', 'Historical Fiction', 'Fiction', 'Adventure', 'Historical', 'Mystery', 'France']",1,-0.02008483408639828,0.2874015339625145,18
371,366,366,473.0,Midnight in the Garden of Good and Evil,John Berendt,3.92,284397.0,9780679751526,0679751521,"Nonfiction, True Crime, Mystery, Crime, History, Classics, Audiobook",,386,Paperback,0.076320939334638,0.73,0.030411454967777,0.3916830985756037,"['Nonfiction', 'True Crime', 'Mystery', 'Crime', 'History', 'Classics', 'Audiobook']",4,-0.4137403896908126,0.3172310621503949,18
372,334,334,431.0,Go Ask Alice,Beatrice Sparks,3.74,283714.0,9781416914631,1416914633,"Young Adult, Fiction, Classics, Contemporary, Mental Health, Banned Books, Realistic Fiction",,213,Paperback,0.1585127201565557,0.685,0.0303381539233927,0.3897127185199872,"['Young Adult', 'Fiction', 'Classics', 'Contemporary', 'Mental Health', 'Banned Books', 'Realistic Fiction']",0,-0.21851497026481156,-0.26780320358375725,8
373,392,392,503.0,The Host,Stephenie Meyer,3.86,1032867.0,9780316068048,0316068047,"Fantasy, Young Adult, Science Fiction, Romance, Fiction, Dystopia, Paranormal","The Host, #1",619,Hardcover,0.0176125244618394,0.715,0.1107388820399455,0.3895878516254462,"['Fantasy', 'Young Adult', 'Science Fiction', 'Romance', 'Fiction', 'Dystopia', 'Paranormal']",0,-0.21888202551213745,-0.2912914762703985,8
374,347,347,448.0,Stargirl,Jerry Spinelli,3.77,332342.0,9780439488402,0439488400,"Young Adult, Fiction, Contemporary, Romance, Realistic Fiction, Middle Grade, Childrens","Stargirl, #1",186,Paperback,0.1252446183953033,0.6925,0.0355570165680751,0.3864504087408446,"['Young Adult', 'Fiction', 'Contemporary', 'Romance', 'Realistic Fiction', 'Middle Grade', 'Childrens']",0,-0.21074863792059476,-0.3610279599998502,8
375,359,359,464.0,The English Patient,Michael Ondaatje,3.86,136025.0,9780771068713,0771068719,"Fiction, Historical Fiction, Classics, Romance, War, Historical, Canada",,320,Hardcover,0.0939334637964774,0.715,0.0144878494664853,0.3846053283157407,"['Fiction', 'Historical Fiction', 'Classics', 'Romance', 'War', 'Historical', 'Canada']",1,-0.03571444454902838,0.2534951339870852,18
376,397,397,511.0,Anna and the French Kiss,Stephanie Perkins,3.96,460405.0,9780525423270,0525423273,"Romance, Young Adult, Contemporary, Fiction, Chick Lit, Realistic Fiction, Contemporary Romance","Anna and the French Kiss, #1",372,Hardcover,0.0019569471624265,0.74,0.0493010160512115,0.3828144908034095,"['Romance', 'Young Adult', 'Contemporary', 'Fiction', 'Chick Lit', 'Realistic Fiction', 'Contemporary Romance']",0,-0.25561684267242407,-0.24597630232431164,8
377,317,317,410.0,Gulliver’s Travels,Jonathan Swift,3.59,289443.0,9780141439495,B06XVF5QFY,"Classics, Fiction, Fantasy, Adventure, Literature, Novels, 18th Century",,306,Paperback,0.1996086105675147,0.6475,0.0309530026543993,0.3813904033054785,"['Classics', 'Fiction', 'Fantasy', 'Adventure', 'Literature', 'Novels', '18th Century']",4,-0.2360448957836204,0.2072328627483901,18
378,354,354,458.0,Zen and the Art of Motorcycle Maintenance: An Inquiry Into Values,Robert M. Pirsig,3.78,238678.0,9780060589462,0060589469,"Philosophy, Fiction, Classics, Spirituality, Travel, Psychology, Self Help","Phaedrus, #1",540,Mass Market Paperback,0.1056751467710372,0.695,0.0255047925253111,0.3802949848240871,"['Philosophy', 'Fiction', 'Classics', 'Spirituality', 'Travel', 'Psychology', 'Self Help']",4,-0.22311306264771136,0.2388882900871644,18
